<?xml version="1.0" encoding="UTF-8"?>
<CD titulo="CD1" xmlns="EJ4" xmlns:xsi="http://www.w3.org/2001/XMLSchema-instance" xsi:schemaLocation="EJ4 EJ4Schema.xsd" >


<fecha>2004-04-24</fecha>
<canciones>
    <cancion>
        
    <titulo >Give it 2 me</titulo>
    <compositores>
    <compositor>
    
        <nombre>Pharrell</nombre>
        <apellidos>Williams</apellidos>
    </compositor>
    </compositores>
    
    <productores>
        <productor>
            <nombre>Pharrell</nombre>
            <apellidos>Williams</apellidos>
        </productor>
    </productores>
    
    <sello>Warner Bros. Records</sello>
    <artista>Madonna</artista>
    </cancion>

</canciones>








</CD>
